{
  "engine_version": "0.2.0",
  "request_id": "ppt-ai-handoff-smoke-001",
  "deck": {
    "title": "Private Project → Public PPT Engine",
    "layout": "LAYOUT_WIDE",
    "author": "PPT Production Engine Integration Test",
    "company": "riyuewuxing",
    "subject": "AI-mediated private project handoff smoke test",
    "language": "zh-CN",
    "theme": {
      "headFontFace": "Noto Sans CJK SC",
      "bodyFontFace": "Noto Sans CJK SC",
      "lang": "zh-CN"
    }
  },
  "output": {
    "pptx": "dist/handoff/current/engine-generated-smoke.pptx",
    "qa_dir": "dist/handoff/current/qa",
    "render_dir": "dist/handoff/current/rendered"
  },
  "quality": {
    "min_slides": 6,
    "require_wide": true,
    "render_dpi": 144
  },
  "slides": [
    {
      "type": "title",
      "title": "Private → AI → Engine → AI → Private",
      "subtitle": "ChatGPT 负责跨仓库交接；Public Engine 只负责构建、真实渲染与 QA"
    },
    {
      "type": "section",
      "eyebrow": "INPUT",
      "title": "输入由 ChatGPT 提取",
      "body": "Public PPT Production Engine 不需要 Private 仓库 token，也不主动 checkout 私有项目。"
    },
    {
      "type": "bullets",
      "title": "引擎只承担生产机械工作",
      "bullets": [
        "读取受约束的 PPT build manifest",
        "使用成熟 PptxGenJS 生成 PPTX",
        "执行 package/hash QA",
        "使用 LibreOffice + Poppler 真实渲染"
      ]
    },
    {
      "type": "two_column",
      "title": "职责严格分离",
      "left_title": "ChatGPT / Private Project",
      "left_items": ["领域内容与素材", "构建包提取", "最终视觉验收", "结果写回 Private"],
      "right_title": "Public Engine",
      "right_items": ["PPTX 构建", "真实渲染", "通用 QA", "GitHub-hosted runner"]
    },
    {
      "type": "timeline",
      "title": "一次完整构建",
      "steps": ["AI 提取", "Engine 构建", "真实渲染", "AI 取回", "写回 Private"]
    },
    {
      "type": "checklist",
      "title": "这次测试什么时候才算 PASS",
      "items": [
        "Public runner 成功生成 PPTX",
        "package QA 与 render QA 都是 PASS",
        "两份 QA 绑定同一个 PPTX SHA-256",
        "完整渲染页数等于 6",
        "ChatGPT 将最终结果写回 Private PPT 仓库"
      ]
    }
  ]
}
